id,Headline,ReportDate,Link,DiseaseLevel1,DiseaseLevel2,Country,HR: Textually explicit activities,HR Notes,MM: Textually explicit activities,MM Notes,Flag for discussion,DONid,RK/CC notes,Master coding,Master coding fixed names
1,1996 - Haemorrhagic fever with renal syndrome in Bosnia and Herzegovina,2/5/1996,https://www.who.int/emergencies/disease-outbreak-news/item/1996_02_05-en/,Hantavirus,HFRS,Bosnia and Herzegovina,"Collect biological and environmental samples,Count cases,Count deaths,Identify agent based on laboratory testing,National-level notification of potential public health emergency","""Examination of patient sera found evidence of infection by at least two hantaviruses"" --assumed that ""patient sera"" meant collection of bio sample

DON also includes information on transmission / vulnerable pops of HFRS -- but doesn't say that this is how THIS specific instance was transmit / who is at-risk. Provides overview information.","Count cases,Count deaths,Determine mode of transmission,Identify agent based on laboratory testing,Identify at risk population,National-level notification of potential public health emergency","""Examination of patient sera"" assumes collection of biological samples 0 but is not explicitly stated - does that get coded? ",checked,DON-1996-02-05,"RK: I think patient sera means biological samples.   Specific language on at-risk pops and transmission mean probably need to include, even if prose is not tight about reference to this event

CC: +1 but need to make sure we're consistent throughout on ""samples imply collection"" sorta thing","Collect biological and environmental samples,Count cases,Count deaths,Determine mode of transmission,Identify agent based on laboratory testing,Identify at risk population,National-level notification of potential public health emergency","Collect biological and environmental samples, Count cases, Count deaths, Determine mode of transmission, Identify agent based on laboratory testing, Identify at risk population, National-level notification of potential public health emergency"
2,1996 - Cholera in Zaire,4/2/1996,https://www.who.int/emergencies/disease-outbreak-news/item/1996_04_04b-en/,Cholera,,Zaire,"Coordinate response with international partners,Count cases,Count deaths,National-level notification of potential public health emergency,Promote good hygiene practices,Provide clean water,Provide funding and/or financing,Share information and key messages with the public","Not explicit that an outbreak has been determined, even though the existence of the DON implies it.","Coordinate response with international partners,Count cases,Count deaths,National-level notification of potential public health emergency,Promote good hygiene practices,Provide clean water,Provide funding and/or financing,Share information and key messages with the public","DONs date is wrong - WHO webpage says DONs is for April 04, airtable names it at 04-02

***Gen q about tagged country

1/23 - Added ""Coordinate response with international partners"" per new activities identified during convo with Hailey",,DON-1996-04-02,,"Coordinate response with international partners,Count cases,Count deaths,National-level notification of potential public health emergency,Promote good hygiene practices,Provide clean water,Provide funding and/or financing,Share information and key messages with the public","Coordinate response with international partners, Count cases, Count deaths, National-level notification of potential public health emergency, Promote good hygiene practices, Provide clean water, Provide funding and/or financing, Share information and key messages with the public"
3,1996 - Cholera in Malaysia,5/20/1996,https://www.who.int/emergencies/disease-outbreak-news/item/1996_05_20-en/,Cholera,,Malaysia,"Confirm diagnoses,Count cases,Identify agent based on laboratory testing,Initiate epidemiological investigation,Provide clinical care","Diagnose cases is implied, but not specified; only ""confirm diagnoses"" is textually explicit.

""The Ministry of Health of Malaysia has taken stringent measures to control the outbreak"" with no indication of what those measures are. 

Also recommends visitors follow ""normal recommendations.","Confirm diagnoses,Count cases,Identify agent based on laboratory testing,Initiate epidemiological investigation,Provide clinical care","'stringent measures to control outbreak' - no details as to what that actually means, maybe 'Implement IPC measures""?",,DON-1996-05-20,,"Confirm diagnoses,Count cases,Identify agent based on laboratory testing,Initiate epidemiological investigation,Provide clinical care","Confirm diagnoses, Count cases, Identify agent based on laboratory testing, Initiate epidemiological investigation, Provide clinical care"
4,1996 - Meningococcal infection in the Balearic Isles (Spain) - Update,6/3/1996,https://www.who.int/emergencies/disease-outbreak-news/item/1996_06_03-en/,Meningococcal disease,,Spain,"Conduct disease surveillance,Provide medical countermeasures (MCMs),Share information and key messages with the public","""Instituted antibiotic therapy"" -- is this provide clinical care?

","Conduct disease surveillance,Provide medical countermeasures (MCMs),Share information and key messages with the public",Would this be 'at risk population' - tourist population is clearly called out,,DON-1996-06-03,,"Conduct disease surveillance,Provide medical countermeasures (MCMs),Share information and key messages with the public","Conduct disease surveillance, Provide medical countermeasures (MCMs), Share information and key messages with the public"
5,1996 - Meningococcal infection in the Balearic Isles (Spain) - Update,6/3/1996,https://www.who.int/emergencies/disease-outbreak-news/item/1996_06_03-en/,Meningococcal disease,,United Kingdom,Diagnose cases,"Interesting because it reads as a comment from the UK (more editorial) as opposed to strict epidemiological report.


",Diagnose cases,,,DON-1996-06-03,,Diagnose cases,Diagnose cases
6,1996 - Dengue/dengue haemorrhagic fever in Malaysia and Indonesia,6/14/1996,https://www.who.int/emergencies/disease-outbreak-news/item/1996_06_14b-en/,Dengue fever,,Malaysia,"Count cases,Implement vector control measures",,"Count cases,Implement vector control measures","Added ""implement vector control measures"" after coding convo with Hailey",,DON-1996-06-14-b,,"Count cases,Implement vector control measures","Count cases, Implement vector control measures"
7,1996 - Dengue/dengue haemorrhagic fever in Malaysia and Indonesia,6/14/1996,https://www.who.int/emergencies/disease-outbreak-news/item/1996_06_14b-en/,Dengue fever,,Indonesia,"Count cases,Share information and key messages with the public","""A campaign to educate the public on keeping the environment clean and free of stagnant water, the breeding place for mosquitoes, has been stepped up""  -- to me, this does not indicate the government has been doing vector control measures, just public education. ","Count cases,Share information and key messages with the public","Should vector control be coded here: "" campaign to educate the public on keeping the environment clean and free of stagnant water, the breeding place for mosquitoes, has been stepped up.""",checked,DON-1996-06-14-b,,"Count cases,Share information and key messages with the public","Count cases, Share information and key messages with the public"
8,1996 - Diphtheria in Laos and Thailand,7/19/1996,https://www.who.int/emergencies/disease-outbreak-news/item/1996_07_19a-en/,Diptheria,,Laos,"Count cases,Count deaths,Initiate epidemiological investigation,Provide medical countermeasures (MCMs)","""planning of mass campaigns to contain the epidemic in both countries"" -- what could that be?","Count cases,Count deaths,Initiate epidemiological investigation,Provide medical countermeasures (MCMs)","Added ""provide MCMs"" activity after review with Hailey",,DON-1996-07-19-a,,"Count cases,Count deaths,Initiate epidemiological investigation,Provide medical countermeasures (MCMs)","Count cases, Count deaths, Initiate epidemiological investigation, Provide medical countermeasures (MCMs)"
9,1996 - Diphtheria in Laos and Thailand,7/19/1996,https://www.who.int/emergencies/disease-outbreak-news/item/1996_07_19a-en/,Diptheria,,Thailand,"Count cases,Initiate epidemiological investigation,Provide medical countermeasures (MCMs)","Not including count deaths because not specified for Thailand

""planning of mass campaigns to contain the epidemic in both countries"" -- assume vaccines or no?","Count cases,Initiate epidemiological investigation,Provide medical countermeasures (MCMs)","""Planning of mass campaigns to contain the epidemic in both countries"" - is the DONS missing a word? Shouldn't this be a vaccination campaign? Especially if the source is WHO Global Programme on Vaccines and Immunizations, GPV",,DON-1996-07-19-a,,"Count cases,Initiate epidemiological investigation,Provide medical countermeasures (MCMs)","Count cases, Initiate epidemiological investigation, Provide medical countermeasures (MCMs)"
10,1996 - Cholera in Nigeria - Update 4,7/19/1996,https://www.who.int/emergencies/disease-outbreak-news/item/1996_07_19c-en/,Cholera,,Nigeria,"Count cases,Count deaths,Explore fundraising options","Has different numbers of cases reported between the two paragraphs for the same country. 

Does ""WHO is in the process of organizing supplies"" align more with exploring fundraising, or providing funding/financing or MCMs?","Count cases,Count deaths,Provide funding and/or financing","""WHO is in the process of organizing supplies and aid which are urgently needed to assist in the control of this epidemic.""
GOAL separates out different types of aid (financial, food, water, health, ag.) so tough to map without additional information",checked,DON-1996-07-19-c,"RK: I read this as exploring financing.  Not providing funding

CC I'm unsure I would put either
","Count cases,Count deaths,Explore fundraising options","Count cases, Count deaths, Explore fundraising options"
11,1996 - Outbreak of food-borne intoxication in India,8/12/1996,https://www.who.int/emergencies/disease-outbreak-news/item/1996_08_12a-en/,Syndromic: gastrointestinal,Food-borne,India,"Issue request for assistance,Provide medical countermeasures (MCMs)","""Experts from the National Institute for Communicable Diseases, Delhi, have been called to investigate the cause of outbreak and to advise on its control"" -- reads as a request for assistance, not that they have initiated investigation.","Coordinate response with international partners,Initiate epidemiological investigation,Provide medical countermeasures (MCMs)","""Experts from the National Institute for Communicable Diseases, Delhi, have been called to investigate the cause of outbreak and to advise on its control."" - coordinate w/ international partners; initiate epi investigation",checked,DON-1996-08-12-a,"RK: I would go with initiate epi investigations (not coordination or request for assistance)

CC +1 on investigation, might also say issue request for assistance?
","Initiate epidemiological investigation,Issue request for assistance,Provide medical countermeasures (MCMs)","Initiate epidemiological investigation, Issue request for assistance, Provide medical countermeasures (MCMs)"
12,1996 - Cholera in Mongolia - Update 2,8/21/1996,https://www.who.int/emergencies/disease-outbreak-news/item/1996_08_21a-en/,Cholera,,Mongolia,"Count cases,Count deaths,Publish and share data","Not clear which entity is involved in reporting (local reporting to national, general national reporting, or national reporting to WHO)","Count cases,Count deaths,Publish and share data","While cholera is an IHR reportable disease, level of reporting is unclear. Was the MOH report to the WHO? Was it a national level report? 

""Document and communicate results of epidemiological investigation"" refers to MOH reports, but the DONS does not specifically refer to an epi investigation, so leaving this out",checked,DON-1996-08-21-a,,"Count cases,Count deaths,Publish and share data","Count cases, Count deaths, Publish and share data"
13,1996 - Dengue/dengue haemorrhagic fever in India - Update,10/24/1996,https://www.who.int/emergencies/disease-outbreak-news/item/1996_10_24-en/,Dengue fever,,India,"""Collect, manage, and share surveillance data across sectors"",Count cases,Count deaths,Identify agent based on laboratory testing,National-level notification of potential public health emergency",,"""Collect, manage, and share surveillance data across sectors"",Count cases,Count deaths,Identify agent based on laboratory testing,National-level notification of potential public health emergency",Reports from hospitals are a standard source for IBS,checked,DON-1996-10-24,,"""Collect, manage, and share surveillance data across sectors"",Count cases,Count deaths,Identify agent based on laboratory testing,National-level notification of potential public health emergency","Collect/manage/share surveillance data across sectors, Count cases, Count deaths, Identify agent based on laboratory testing, National-level notification of potential public health emergency"
14,1996 - Dengue/dengue haemorrhagic fever in India - Update,10/31/1996,https://www.who.int/emergencies/disease-outbreak-news/item/1996_10_31a-en/,Dengue fever,,India,"Count cases,Count deaths,Identify agent based on laboratory testing,National-level notification of potential public health emergency","Text implies that cases were diagnosed, but this is not explicit in the text. ","Count cases,Count deaths,Identify agent based on laboratory testing,National-level notification of potential public health emergency","Removed ""share information and key messages...."" because it is not explicit that the control guidance was shared with the public. ",,DON-1996-10-31-a,,"Count cases,Count deaths,Identify agent based on laboratory testing,National-level notification of potential public health emergency","Count cases, Count deaths, Identify agent based on laboratory testing, National-level notification of potential public health emergency"
15,1996 - Dengue haemorrhagic fever in India,11/12/1996,https://www.who.int/emergencies/disease-outbreak-news/item/1996_11_12b-en/,Dengue fever,,India,"Coordinate national response across sectors,Coordinate response with international partners,Count cases,Count deaths,National-level notification of potential public health emergency","NICD reported based on hospitals in Delhi (national-level notification), but it's not clear that these were explicitly reported to WHO or whether WHO just was made aware of the reports.

Reports activities that would be duties of the technical meeting (i.e. case management, public information campaign, etc.) but that are not actually underway.","Coordinate national response across sectors,Coordinate response with international partners,Count cases,Count deaths,National-level notification of potential public health emergency",,checked,DON-1996-11-12-b,,"Coordinate national response across sectors,Coordinate response with international partners,Count cases,Count deaths,National-level notification of potential public health emergency","Coordinate national response across sectors, Coordinate response with international partners, Count cases, Count deaths, National-level notification of potential public health emergency"
16,1996 - Ebola haemorrhagic fever in South Africa - Update,11/22/1996,https://www.who.int/emergencies/disease-outbreak-news/item/1996_11_22-en/,Ebola virus,,South Africa,"Carry out screening/testing activities,Monitor and manage suspected cases,Perform contact tracing activities,Share information and key messages with the public",,"Carry out screening/testing activities,Monitor and manage suspected cases,Perform contact tracing activities,Share information and key messages with the public",,,DON-1996-11-22,,"Carry out screening/testing activities,Monitor and manage suspected cases,Perform contact tracing activities,Share information and key messages with the public","Carry out screening/testing activities, Monitor and manage suspected cases, Perform contact tracing activities, Share information and key messages with the public"
17,"1996 - Cholera in refugees: Kigoma, Tanzania",12/6/1996,https://www.who.int/emergencies/disease-outbreak-news/item/1996_12_06c-en/,Cholera,,Tanzania,"Collect biological and environmental samples,Conduct disease surveillance,Confirm diagnoses,Construct case definitions,Coordinate response with international partners,Count cases,Count deaths,Diagnose cases,Ensure power is available for humanitarian response activities,""Ensure proper water, sanitation, and hygiene (WASH)"",Ensure vulnerable populations' access to care and resources,Identify agent based on laboratory testing,Identify at risk population,Initiate medical response,""Maintain sanitation of facilities, buildings, vehicles and equipment"",Perform active case finding,Procure diagnostics and laboratory testing material,Procure sampling material,Promote good hygiene practices,Provide clean water,Provide clinical care,Provide shelter for displaced populations,Transport or evacuate patients,Transport samples domestically","Good example where specific actions are named.

DON-1996-12-06-c provides a note with the case definition, implying it has been constructed.

No activity for deployment of community health workers, but sort of fits under ""initiate medical response"" along with expanded bed access

""Latrines have been built"" -- should this be considered as providing an essential hygiene item?
","Collect biological and environmental samples,Conduct disease surveillance,Confirm diagnoses,Construct case definitions,Coordinate response with international partners,Count cases,Count deaths,Diagnose cases,Ensure power is available for humanitarian response activities,""Ensure proper water, sanitation, and hygiene (WASH)"",Ensure vulnerable populations' access to care and resources,Identify agent based on laboratory testing,Identify at risk population,Initiate medical response,""Maintain sanitation of facilities, buildings, vehicles and equipment"",Perform active case finding,Procure diagnostics and laboratory testing material,Procure sampling material,Promote good hygiene practices,Provide clean water,Provide clinical care,Provide shelter for displaced populations,Transport or evacuate patients,Transport samples domestically",,,DON-1996-12-06-c,,"Collect biological and environmental samples,Conduct disease surveillance,Confirm diagnoses,Construct case definitions,Coordinate response with international partners,Count cases,Count deaths,Diagnose cases,Ensure power is available for humanitarian response activities,""Ensure proper water, sanitation, and hygiene (WASH)"",Ensure vulnerable populations' access to care and resources,Identify agent based on laboratory testing,Identify at risk population,Initiate medical response,""Maintain sanitation of facilities, buildings, vehicles and equipment"",Perform active case finding,Procure diagnostics and laboratory testing material,Procure sampling material,Promote good hygiene practices,Provide clean water,Provide clinical care,Provide shelter for displaced populations,Transport or evacuate patients,Transport samples domestically","Collect biological and environmental samples, Conduct disease surveillance, Confirm diagnoses, Construct case definitions, Coordinate response with international partners, Count cases, Count deaths, Diagnose cases, Ensure power is available for humanitarian response activities, Ensure proper water/sanitation/hygiene (WASH), Ensure vulnerable populations have access to care and resources, Identify agent based on laboratory testing, Identify at risk population, Initiate medical response, Maintain sanitation of facilities/buildings/vehicles/equipment, Perform active case finding, Procure diagnostics and laboratory testing material, Procure sampling material, Promote good hygiene practices, Provide clean water, Provide clinical care, Provide shelter for displaced populations, Transport or evacuate patients, Transport samples domestically"
18,1997 - Meningitis in Ghana - Update,3/21/1997,https://www.who.int/emergencies/disease-outbreak-news/item/1997_03_21a-en/,Syndromic: neurological,Meningitis,Ghana,"Complete descriptive analysis of outbreak,Count cases,Count deaths,Create inter-agency coordinating committee,Initiate immunization campaign,Monitor and manage suspected cases,Procure and transport medical countermeasures (MCMs),Share information and key messages with the public","""The Ministry of Health is basing its control strategy on health education, case management and vaccination activities"" -- doesn't actually mean it's implementing those things, just planning.

""External support has been obtained"" -- no activity for the actual provision (just the request) in GOAL.

Debatable whether the reporting in DON constitutes a descriptive analysis","Complete descriptive analysis of outbreak,Count cases,Count deaths,Create inter-agency coordinating committee,Initiate immunization campaign,Monitor and manage suspected cases,Procure and transport medical countermeasures (MCMs),Share information and key messages with the public","Control strategy: health education (share information and key messages), case management (monitor and manage cases) and vaccination (transport and dispense vaccines) activities. A task force has been created to coordinate reporting (manage and coordinate data reporting) and the support to the affected regions. External support has been obtained (issue request for assistance AND/OR request financial resources) to purchase vaccine, injection material and drugs.",,DON-1997-03-21-a,,"Complete descriptive analysis of outbreak,Count cases,Count deaths,Create inter-agency coordinating committee,Initiate immunization campaign,Monitor and manage suspected cases,Procure and transport medical countermeasures (MCMs),Share information and key messages with the public","Complete descriptive analysis of outbreak, Count cases, Count deaths, Create inter-agency coordinating committee, Initiate immunization campaign, Monitor and manage suspected cases, Procure and transport medical countermeasures (MCMs), Share information and key messages with the public"
19,1997 - Meningitis in Ghana - Update,3/21/1997,https://www.who.int/emergencies/disease-outbreak-news/item/1997_03_21a-en/,Syndromic: neurological,Meningitis,Burkina Faso,"Count cases,Count deaths","Not clear which entity is involved in reporting (local reporting to national, general national reporting, or national reporting to WHO)

Separate, but this DON is split into 5 different lines based on one sentence at the end, which is different than previous DONs which did not do this (DON-1996-04-02, for example)
","Count cases,Count deaths","Part of DON-1997-03-21-a, country case load (and no other information) referenced in final sentence",,DON-1997-03-21-a,,"Count cases,Count deaths","Count cases, Count deaths"
20,1997 - Meningitis in Ghana - Update,3/21/1997,https://www.who.int/emergencies/disease-outbreak-news/item/1997_03_21a-en/,Syndromic: neurological,Meningitis,Chad,"Count cases,Count deaths","Maybe a stretch on count cases?

Separate, but this DON is split into 5 different lines based on one sentence at the end, which is different than previous DONs which did not do this (DON-1996-04-02, for example)","Count cases,Count deaths","Part of DON-1997-03-21-a, country case load (and no other information) referenced in final sentence",,DON-1997-03-21-a,,"Count cases,Count deaths","Count cases, Count deaths"
21,1997 - Meningitis in Ghana - Update,3/21/1997,https://www.who.int/emergencies/disease-outbreak-news/item/1997_03_21a-en/,Syndromic: neurological,Meningitis,Gambia,"Count cases,Count deaths","Maybe a stretch on count cases?

Separate, but this DON is split into 5 different lines based on one sentence at the end, which is different than previous DONs which did not do this (DON-1996-04-02, for example)","Count cases,Count deaths","Part of DON-1997-03-21-a, country case load (and no other information) referenced in final sentence",,DON-1997-03-21-a,,"Count cases,Count deaths","Count cases, Count deaths"
22,1997 - Meningitis in Ghana - Update,3/21/1997,https://www.who.int/emergencies/disease-outbreak-news/item/1997_03_21a-en/,Syndromic: neurological,Meningitis,Mali,"Count cases,Count deaths","Maybe a stretch on count cases?

Separate, but this DON is split into 5 different lines based on one sentence at the end, which is different than previous DONs which did not do this (DON-1996-04-02, for example)","Count cases,Count deaths","Part of DON-1997-03-21-a, country case load (and no other information) referenced in final sentence",,DON-1997-03-21-a,,"Count cases,Count deaths","Count cases, Count deaths"
23,1997 - Meningitis in Ghana - Update,3/21/1997,https://www.who.int/emergencies/disease-outbreak-news/item/1997_03_21a-en/,Syndromic: neurological,Meningitis,Togo,"Count cases,Count deaths","Maybe a stretch on count cases?

Separate, but this DON is split into 5 different lines based on one sentence at the end, which is different than previous DONs which did not do this (DON-1996-04-02, for example)","Count cases,Count deaths","Part of DON-1997-03-21-a, country case load (and no other information) referenced in final sentence",,DON-1997-03-21-a,,"Count cases,Count deaths","Count cases, Count deaths"
