117,Human influenza A(H3N2) activity remains widespread in many countries - update 7,1/13/2004,https://www.who.int/emergencies/disease-outbreak-news/item/2004_01_13a-en/,Influenza A,H3N2,Global,,"Based on prior methods, seems like there should be a line for each country mentioned? Otherwise just a DONs informational / status update about influenza

PROPOSAL: Exclude """"Global"""" DONS and any non-country DONS from sample. 

1. They seem to break with the methodology of the DONs dataset -- i.e. even when countries are mentioned, they're not separated out as line listings but rather aggregated together. Example for this one: WHO received a specific report from Hong Kong in this DON...there is no line for Hong Kong, it's marked as global, so I did not include those activities. Would need a new line for Hong Kong if so. Similarly, Hong Kong DOH set up a hotline and implemented IPC measures  -- NOT global, so didn't tag.

2. Because Global DONS aggregate a bunch of different countries together which could bias results

3. GOAL doesn't seem to map well with """"global"""" DONs where there is no country identified / taking action, but describing actions from global community with respect to WHO -- GOAL wasn't set up to account for all the actions that an IO could take (i.e. WHO issued travel advisory -- no activity in GOAL to align with this)",,"Unsure how to code. An example of a global DONs which lists several countries. Do we code just the summary or all country lines?

Summary is also a weird mix of global info and country specific details

I coded just the summary info that was not country specific",checked,DON-2004-01-13-b,,,
118,Human influenza A/H3N2 activity increases in many countries in central and eastern Europe - update 8,1/21/2004,https://www.who.int/emergencies/disease-outbreak-news/item/2004_01_21-en/,Influenza A,H3N2,Global,Conduct disease surveillance,"Based on prior methods, seems like there should be a line for each country mentioned? Otherwise just a DONs informational / status update about influenza",Conduct disease surveillance,"DONs country title is Panama - but Panama is not a country affiliated with the outbreak.

Unsure how to code. An example of a regional DONs which lists several countries. Do we code just the summary or all country lines?

I coded just the summary",checked,DON-2004-01-21,,Conduct disease surveillance,Conduct disease surveillance
119,"Avian influenza A(H5N1) - update 18: FAO/OIE/WHO Technical Consultation on the Control of Avian Influenza,  Situation (human) in Thailand and VietNam",2/5/2004,https://www.who.int/emergencies/disease-outbreak-news/item/2004_02_05-en/,Influenza A,H5N1,Vietnam,"Confirm diagnoses,Count cases,Count deaths,Identify agent based on laboratory testing,WHO/WOAH notification","I feel like ""collect antemortem data"" when they've just counted fatalities is not super accurate -- this one made me realize bc clearly they're just following the cases?","Confirm diagnoses,Count cases,Count deaths,Identify agent based on laboratory testing,WHO/WOAH notification",,,DON-2004-02-05,,"Confirm diagnoses,Count cases,Count deaths,Identify agent based on laboratory testing,WHO/WOAH notification","Confirm diagnoses, Count cases, Count deaths, Identify agent based on laboratory testing, WHO/WOAH notification"
120,"Avian influenza A(H5N1) - update 18: FAO/OIE/WHO Technical Consultation on the Control of Avian Influenza,  Situation (human) in Thailand and Viet Nam",2/5/2004,https://www.who.int/emergencies/disease-outbreak-news/item/2004_02_05-en/,Influenza A,H5N1,Thailand,"Confirm diagnoses,Count cases,Count deaths",,"Confirm diagnoses,Count cases,Count deaths","No specific mention of laboratory for confirmation. We can infer that confirmation of H5N1 is via laboratory testing, but should we?",,DON-2004-02-05,,"Confirm diagnoses,Count cases,Count deaths","Confirm diagnoses, Count cases, Count deaths"
121,Nipah-like virus in Bangladesh,2/12/2004,https://www.who.int/emergencies/disease-outbreak-news/item/2004_02_12-en/,Nipah virus,Nipah virus-B,Bangladesh,"Collect biological and environmental samples,Coordinate response with international partners,Count cases,Count deaths,Identify agent based on laboratory testing,Initiate epidemiological investigation,Plan systematic study,Provide technical assistance,WHO/WOAH notification",""" A team comprising experts from WHO, partners in the Global Outbreak Alert and Response Network, (CDC Atlanta, Epiet, France and the International Centre for Diarrhoeal Disease Research, Bangladesh) and the Institute of Epidemiology Disease Control and Research, Bangladesh is assisting the Ministry with epidemiological investigations."" = technical assistance; international partners

"" Further activities include case control studies, sero-surveys of humans, and sero-surveys of animals in the region to identify the viral reservoir."" -- sero-surveys = collect samples","Coordinate response with international partners,Count cases,Count deaths,Identify agent based on laboratory testing,Initiate epidemiological investigation,Plan systematic study,Provide technical assistance,WHO/WOAH notification",,checked,DON-2004-02-12-a,"RK: yes on collect bio samples. (implied from sero-surveys

CC: +1","Collect biological and environmental samples,Coordinate response with international partners,Count cases,Count deaths,Identify agent based on laboratory testing,Initiate epidemiological investigation,Plan systematic study,Provide technical assistance,WHO/WOAH notification","Collect biological and environmental samples, Coordinate response with international partners, Count cases, Count deaths, Identify agent based on laboratory testing, Initiate epidemiological investigation, Plan systematic study, Provide technical assistance, WHO/WOAH notification"
122,Recent outbreaks of cholera in Africa,2/18/2004,https://www.who.int/emergencies/disease-outbreak-news/item/2004_02_18a-en/,Cholera,,Burundi,"Count cases,Count deaths,Initiate epidemiological investigation,Provide clean water",,"Count cases,Count deaths,Initiate epidemiological investigation,Provide clean water",,,DON-2004-02-18-b,,"Count cases,Count deaths,Initiate epidemiological investigation,Provide clean water","Count cases, Count deaths, Initiate epidemiological investigation, Provide clean water"
123,Recent outbreaks of cholera in Africa,2/18/2004,https://www.who.int/emergencies/disease-outbreak-news/item/2004_02_18a-en/,Cholera,,Cameroon,"Coordinate response with international partners,Count cases,Count deaths,Provide technical assistance","""WHO, UNICEF and Médecins sans Frontières are supporting local health authorities in outbreak control."" = coordinate with international partners; provide tech assistance","Coordinate response with international partners,Count cases,Count deaths,Provide technical assistance",,,DON-2004-02-18-b,,"Coordinate response with international partners,Count cases,Count deaths,Provide technical assistance","Coordinate response with international partners, Count cases, Count deaths, Provide technical assistance"
124,Recent outbreaks of cholera in Africa,2/18/2004,https://www.who.int/emergencies/disease-outbreak-news/item/2004_02_18a-en/,Cholera,,Mali,"Count cases,Count deaths,Provide funding and/or financing",,"Count cases,Count deaths,Provide funding and/or financing","How does ""providing medical supplies and specific technical assistance to control the outbreak."" get captured? ",,DON-2004-02-18-b,,"Count cases,Count deaths,Provide funding and/or financing","Count cases, Count deaths, Provide funding and/or financing"
125,Recent outbreaks of cholera in Africa,2/18/2004,https://www.who.int/emergencies/disease-outbreak-news/item/2004_02_18a-en/,Cholera,,Mozambique,"Count cases,Count deaths",,"Count cases,Count deaths",,,DON-2004-02-18-b,,"Count cases,Count deaths","Count cases, Count deaths"
126,Recent outbreaks of cholera in Africa,2/18/2004,https://www.who.int/emergencies/disease-outbreak-news/item/2004_02_18a-en/,Cholera,,South Africa,"Count cases,Count deaths",,"Count cases,Count deaths",,,DON-2004-02-18-b,,"Count cases,Count deaths","Count cases, Count deaths"
127,Recent outbreaks of cholera in Africa,2/18/2004,https://www.who.int/emergencies/disease-outbreak-news/item/2004_02_18a-en/,Cholera,,Zambia,"Count cases,Count deaths,Provide technical assistance","""Médecins sans Frontières-Spain is supporting case management through cholera treatment centres. "" provide technical assistance

""WHO is providing medical supplies and supporting local health staff."" -- coordinate with international partners; and how else?

""In addition, a WHO mission comprising an epidemiologist and a water and sanitation engineer is currently assessing the situation and proposing additional control measures."" =?","Count cases,Count deaths,Provide technical assistance","""Médecins sans Frontières-Spain is supporting case management through cholera treatment centres. WHO is providing medical supplies and supporting local health staff."" How should this get parsed?",,DON-2004-02-18-b,,"Count cases,Count deaths,Provide technical assistance","Count cases, Count deaths, Provide technical assistance"
128,Meningococcal disease in Burkina Faso,3/26/2004,https://www.who.int/emergencies/disease-outbreak-news/item/2004_03_26-en/,Meningococcal disease,,Burkina Faso,"Confirm diagnoses,Count cases,Count deaths,Determine the existence of an outbreak,Identify agent based on laboratory testing,Initiate immunization campaign,Issue request for assistance,Provide medical countermeasures (MCMs)","Mentions epidemic threshold = determine existence of outbreak

Mentions that the MoH requested vaccines -- don't think we can say this is procurement, but the vaccines were provided-- "" Following a request from the Ministry of Health, the International Coordinating Group (ICG) on Vaccine Provision for Epidemic Meningitis Controlhas provided 130, 000 doses of trivalent (ACW135) vaccine. An immunization campaign is planned for Naonoro district."" = provide MCMs; immunization campaign

"" Neisseria meningitidis serogroups A and W135 have been laboratory confirmed, the latter in Naonoro district."" = confirm diagnoses","Confirm diagnoses,Count cases,Count deaths,Determine the existence of an outbreak,Identify agent based on laboratory testing,Initiate immunization campaign,Issue request for assistance,Provide medical countermeasures (MCMs)",,,DON-2004-03-26-a,,"Confirm diagnoses,Count cases,Count deaths,Determine the existence of an outbreak,Identify agent based on laboratory testing,Initiate immunization campaign,Issue request for assistance,Provide medical countermeasures (MCMs)","Confirm diagnoses, Count cases, Count deaths, Determine the existence of an outbreak, Identify agent based on laboratory testing, Initiate immunization campaign, Issue request for assistance, Provide medical countermeasures (MCMs)"
129,Additional patients in China under investigation for SARS; WHO team travels to Beijing - update 2,4/26/2004,https://www.who.int/emergencies/disease-outbreak-news/item/2004_04_26-en/,SARS-CoV,,China,"Collect biological and environmental samples,Collect case patient information,Conduct disease surveillance,Consider enforcing physical distancing measures of infectious patients,Coordinate response with international partners,Count cases,Create and distribute standard treatment guidance ,Develop hypothesis to explain specific exposure that caused disease,Diagnose cases,""Establish physical distancing measures in healthcare facilities, treatment centers, and the broader community"",Implement infection prevention and control (IPC) measures,Initiate attribution investigation,Initiate epidemiological investigation,Issue request for assistance,Monitor and manage suspected cases,Perform active case finding,Perform contact tracing activities,Provide clinical care,Provide technical assistance","""WHO is today sending the first members of an international team to help investigate the source of SARS cases recently reported in Beijing and the eastern province of Anhui. The team, which is expected to begin work on Wednesday, will include experts in epidemiology, virology, infection control, and laboratory biosafety."" provide tech assistance; attribution?

""Share samples"" --maybe manage clinical data?


""a suspicion of SARS led to the introduction of adequate precautionary measures, including isolation of patients and strict procedures for infection control."" --create and distribute treatment guidance + consider enforcing physical distancing

"" Numerous environmental samples from the laboratory have been taken to help assess possible sources of contamination"" = collect biological and environmental samples

"" The most recent cases, announced on Sunday, are four close contacts of a 20-year-old nurse who treated the Anhui student at a Beijing hospital. The cases – all in Beijing – are currently under investigation. They include the nurse’s mother, father, aunt, and a woman who shared a hospital ward with the nurse when she was undergoing treatment. Onset of symptoms for all four persons occurred between 16 and 19 April. The nurse’s mother is in serious condition following the development of pneumonia. The other three persons are in stable condition."" = case patient information
","Collect biological and environmental samples,Collect case patient information,Conduct disease surveillance,Consider enforcing physical distancing measures of infectious patients,Coordinate response with international partners,Count cases,Create and distribute standard treatment guidance ,Develop hypothesis to explain specific exposure that caused disease,Diagnose cases,""Establish physical distancing measures in healthcare facilities, treatment centers, and the broader community"",Implement infection prevention and control (IPC) measures,Initiate attribution investigation,Initiate epidemiological investigation,Issue request for assistance,Monitor and manage suspected cases,Perform active case finding,Perform contact tracing activities,Provide clinical care,Provide technical assistance","Coordinate with international partners: ""At the request of the Chinese Ministry of Health, WHO is today sending the first members of an international team to help investigate the source of SARS cases""

implement IPC measures; establish physical distancing measures: ""a suspicion of SARS led to the introduction of adequate precautionary measures, including isolation of patients and strict procedures for infection control.""""


First time I think attribution investigation is relevant

Another DONs where biosafety/biosecurity activity would have been coded",checked,DON-2004-04-26,"RK: yes on consider physical distancing, yes on  coordinate with international partners.  I think yes on SOPs based on  ""According to WHO guidelines for the global surveillance of SARS, classification as a confirmed case at the start of an outbreak requires independent verification of results by an external international reference laboratory. Such procedures are considered necessary in view of the implications that confirmed SARS cases can have for international public health.""

CC +1","Collect biological and environmental samples,Collect case patient information,Conduct disease surveillance,Consider enforcing physical distancing measures of infectious patients,Coordinate response with international partners,Count cases,Create and distribute standard treatment guidance ,Develop hypothesis to explain specific exposure that caused disease,Diagnose cases,""Establish physical distancing measures in healthcare facilities, treatment centers, and the broader community"",Implement infection prevention and control (IPC) measures,Initiate attribution investigation,Initiate epidemiological investigation,Issue request for assistance,Monitor and manage suspected cases,Perform active case finding,Perform contact tracing activities,Provide clinical care,Provide technical assistance","Collect biological and environmental samples, Collect case patient information, Conduct disease surveillance, Consider enforcing physical distancing measures of infectious patients, Coordinate response with international partners, Count cases, Create and distribute standard treatment guidance , Develop hypothesis to explain specific exposure that caused disease, Diagnose cases, Establish physical distancing measures in healthcare facilities/treatment centers/the broader community, Implement infection prevention and control (IPC) measures, Initiate attribution investigation, Initiate epidemiological investigation, Issue request for assistance, Monitor and manage suspected cases, Perform active case finding, Perform contact tracing activities, Provide clinical care, Provide technical assistance"
130,Ebola haemorrhagic fever in south Sudan - update 2,5/26/2004,https://www.who.int/emergencies/disease-outbreak-news/item/2004_05_26-en/,Ebola virus,,Sudan,"Confirm diagnoses,Coordinate national response across sectors,Coordinate response with international partners,Count cases,Count deaths,Create inter-agency coordinating committee,Identify agent based on laboratory testing,Initiate medical response,Provide technical assistance,Staff isolation facilities","DRC and Uganda mentioned with activities but don't have lines -- that's why I didn't code ""conduct disease surveillance"" -- it's about DRC/Uganda

""Initiate medical response"" and ""provide tech assistance""and ""coordinate response with international partners"" to cover WHO EWARN / MSF work","Confirm diagnoses,Coordinate national response across sectors,Coordinate response with international partners,Count cases,Count deaths,Create inter-agency coordinating committee,Identify agent based on laboratory testing,Initiate medical response,Provide technical assistance,Staff isolation facilities","MSF  supporting the isolation ward - staff isolation facility

Is the a GOAL activity that captures 'case management'? It gets brought up fairly frequently across the DONs",,DON-2004-05-26,,"Confirm diagnoses,Coordinate national response across sectors,Coordinate response with international partners,Count cases,Count deaths,Create inter-agency coordinating committee,Identify agent based on laboratory testing,Initiate medical response,Provide technical assistance,Staff isolation facilities","Confirm diagnoses, Coordinate national response across sectors, Coordinate response with international partners, Count cases, Count deaths, Create inter-agency coordinating committee, Identify agent based on laboratory testing, Initiate medical response, Provide technical assistance, Staff isolation facilities"
131,Yellow fever in Burkina Faso - update,6/1/2004,https://www.who.int/emergencies/disease-outbreak-news/item/2004_06_01-en/,Yellow fever,,Burkina Faso,,Couldn't access this one,,"Cannot access this DONS ""This page cannot be found""",,DON-2004-06-01-a,,,
132,"Avian Influenza - Necessary precautions to prevent human infection of H5N1, need for virus sharing",7/16/2004,https://www.who.int/emergencies/disease-outbreak-news/item/2004_07_16-en/,Influenza A,H5N1,Asia,,"Details WHO recommendations for HPAI H5N1, but doesn't list country actions / activities",,"WHO recommendations, but no clear activities carried out. This is about guidance, not action. ",,DON-2004-07-16,,,
133,Avian influenza - situation in VietNam - update 6,1/26/2005,https://www.who.int/emergencies/disease-outbreak-news/item/2005_01_26-en/,Influenza A,H5N1,Vietnam,"Collect case patient information,Conduct disease surveillance,Confirm diagnoses,Count cases,Count deaths,Determine mode of transmission,Identify agent based on laboratory testing,Initiate epidemiological investigation,Monitor and manage suspected cases,Provide clinical care,Transport samples internationally","""If limited human-to-human transmission has occurred, all evidence at this stage suggests that the chain of transmission ended after a single person was infected."" = determine mode of transmission?

""As announced previously, a family cluster in northern Viet Nam has been the focus of intense investigation. The cluster involves three brothers. Of these, Vietnamese authorities have identified influenza A H5 infection in two: a 46-year-old man and his 42-year old brother. The older brother developed symptoms on 26 December and died on 9 January. The younger brother was hospitalized with respiratory symptoms on 12 January and has now fully recovered. He is known to have provided bedside care for his older brother during a period of critical illness."" = case patient info","Collect case patient information,Conduct disease surveillance,Confirm diagnoses,Count cases,Count deaths,Determine mode of transmission,Identify agent based on laboratory testing,Initiate epidemiological investigation,Monitor and manage suspected cases,Provide clinical care,Transport samples internationally",I have not been coding collect samples unless explicitly stated. Is that correct?,,DON-2005-01-26,,"Collect case patient information,Conduct disease surveillance,Confirm diagnoses,Count cases,Count deaths,Determine mode of transmission,Identify agent based on laboratory testing,Initiate epidemiological investigation,Monitor and manage suspected cases,Provide clinical care,Transport samples internationally","Collect case patient information, Conduct disease surveillance, Confirm diagnoses, Count cases, Count deaths, Determine mode of transmission, Identify agent based on laboratory testing, Initiate epidemiological investigation, Monitor and manage suspected cases, Provide clinical care, Transport samples internationally"
134,Dengue haemorrhagic fever in Timor-Leste - update 2,2/10/2005,https://www.who.int/emergencies/disease-outbreak-news/item/2005_02_10-en/,Dengue fever,,Timor-Leste,"""Acquire personal protective equipment (PPE), chlorine and detergent, and decontamination tools required"",Complete descriptive analysis of outbreak,Construct case definitions,Coordinate response with international partners,Count cases,Count deaths,Diagnose cases,Implement vector control measures,Provide clinical care,Provide technical assistance,Share information and key messages with the public,Train workforce in clinical care and case management practices","""WHO has been providing technical support and on site training on case management for DHF to doctors and nurses in the National Hospital, Dili, and organized a seminar in which 67 doctors and nurses from all hospitals of Timor-Leste took part."" = provide tech assistance

""With this assistance from WHO and from the staff of the WHO Collaborating Centre for Case Management of Dengue/Dengue Haemorrhagic Fever, Thailand, Queen Sirikit National Institute of Child Health, the case fatality rate has been decreasing in the National Hospital."" = coordinate with intenrational partners

""WHO has also assisted the Ministry of Health with epidemiological data to identify target areas for spraying operations; organized training of supervisors and sprayers in Dili; and provided personal protection equipment for sprayers""= implement vector control","""Acquire personal protective equipment (PPE), chlorine and detergent, and decontamination tools required"",Complete descriptive analysis of outbreak,Construct case definitions,Coordinate response with international partners,Count cases,Count deaths,Diagnose cases,Implement vector control measures,Provide clinical care,Provide technical assistance,Share information and key messages with the public,Train workforce in clinical care and case management practices","Provide clinical care: ""178 hospitalized cases of dengue infection""

Need case management? or is close enough to monitor suspected cases (with an amended description)?",checked,DON-2005-02-10,"RK: yes on provide clinical care

CC: +1
","""Acquire personal protective equipment (PPE), chlorine and detergent, and decontamination tools required"",Complete descriptive analysis of outbreak,Construct case definitions,Coordinate response with international partners,Count cases,Count deaths,Diagnose cases,Implement vector control measures,Provide clinical care,Provide technical assistance,Share information and key messages with the public,Train workforce in clinical care and case management practices","Acquire personal protective equipment (PPE)/chlorine and detergent/decontamination tools required, Complete descriptive analysis of outbreak, Construct case definitions, Coordinate response with international partners, Count cases, Count deaths, Diagnose cases, Implement vector control measures, Provide clinical care, Provide technical assistance, Share information and key messages with the public, Train workforce in clinical care and case management practices"
135,Marburg haemorrhagic fever in Angola - update,3/23/2005,https://www.who.int/emergencies/disease-outbreak-news/item/2005_03_23-en/,Marburg fever,,Angola,,Couldn't access this one,,"Cannot access this DONS ""This page cannot be found""",,DON-2005-03-23-a,,,
